{
  "schema": "sample",
  "model": "Document",
  "actions": {
    "index": {
      "template": "index.template",
      "view": "index.view",
      "index": true,
      "parameters": {
        "Kind": "WBIN"
      }
    }
  },
  "dialogs": {
    "edit": {
      "template": "../document/edit.template",
      "view": "../document/edit.dialog",
      "parameters": {
        "Kind": "WBIN"
      }
    }
  }
}