{
  "schema": "sample",
  "model": "Document",
  "actions": {
    "index": {
      "template": "index.template",
      "view": "index.view",
      "index": true
    },
    "edit": {
      "template": "edit.template",
      "view": "edit.view"
    }
  },
  "dialogs": {
    "edit": {
      "template": "edit.template",
      "view": "edit.dialog"
    }
  }
}